id,Category,name,subtitle,price,discount_price,main_image_url,secondary_image_url
2376,Alimentación infantil,Preparado lácteo crecimiento Hacendado +1 año,Brick 1 L,1.25,,https://prod-mercadona.imgix.net/images/01c077a7a1d4408f51d3b03a924e68fa.jpg?fit=crop&h=300&w=300,
2377,Alimentación infantil,Preparado lácteo cereales al cacao Peques 3 Puleva,3 mini bricks x 200 ml,1.79,"1,79 €",https://prod-mercadona.imgix.net/images/97890c6bb75ab7a977627f665695b50c.jpg?fit=crop&h=300&w=300,
2378,Alimentación infantil,Preparado lácteo con cacao y cereales crecimiento Hacendado +1 año,6 mini bricks x 200 ml,2.2,,https://prod-mercadona.imgix.net/images/ccaa0de750fd09bcb82870afb8b24430.jpg?fit=crop&h=300&w=300,
2379,Alimentación infantil,Preparado lácteo con cereales crecimiento Hacendado +1 año,6 bricks x 1 L,9.0,,https://prod-mercadona.imgix.net/images/e699a50cc6e2a0cf252768c44dc58ee3.jpg?fit=crop&h=300&w=300,
2380,Alimentación infantil,Preparado lácteo con cereales crecimiento Hacendado +1 año,Brick 1 L,1.5,,https://prod-mercadona.imgix.net/images/d20912c3ad645e1e9590a692d4ddce51.jpg?fit=crop&h=300&w=300,
2381,Alimentación infantil,Leche para lactantes en polvo 1 Nativa Nestlé,Bote 800 g,11.95,,https://prod-mercadona.imgix.net/images/75696deaf71e6e6313c74d64a4239e95.jpg?fit=crop&h=300&w=300,
2382,Alimentación infantil,Leche de continuación en polvo 2 Nativa Nestlé,Bote 800 g,11.95,,https://prod-mercadona.imgix.net/images/864398e89e2972bc707e121d6603e190.jpg?fit=crop&h=300&w=300,
2383,Alimentación infantil,Leche para lactantes en polvo 1 Nidina Nestlé,Bote 800 g,14.95,,https://prod-mercadona.imgix.net/images/a4113504cb68b8142e22a493f02d0474.jpg?fit=crop&h=300&w=300,
2384,Alimentación infantil,Leche de continuación en polvo 2 Nidina Nestlé,Bote 800 g,17.95,,https://prod-mercadona.imgix.net/images/4cb22b9e94f249763bdc0737456c8380.jpg?fit=crop&h=300&w=300,
2385,Alimentación infantil,Papilla 8 cereales con galleta María Nestlé +6 meses,Caja 725 g,4.5,"4,50 €",https://prod-mercadona.imgix.net/images/22cd3af9bfc8dc2f545c9dec325a0740.jpg?fit=crop&h=300&w=300,
2386,Alimentación infantil,Papilla 8 cereales con miel Nestlé +6 meses,Caja 725 g,4.5,"4,50 €",https://prod-mercadona.imgix.net/images/5f3eca6c9d4fd9c2ef9ea1218e1c0322.jpg?fit=crop&h=300&w=300,
2387,Alimentación infantil,Papilla 8 cereales Hero Solo +6 meses,Caja 410 g,3.9,,https://prod-mercadona.imgix.net/images/133c26ee0d0c0605eae785e98793b7cf.jpg?fit=crop&h=300&w=300,
2388,Alimentación infantil,Papilla sin gluten crema de arroz Hero Solo +4 meses,Caja 220 g,2.95,,https://prod-mercadona.imgix.net/images/df93989958840997d653077fe5aacace.jpg?fit=crop&h=300&w=300,
2389,Toallitas y pañales,Toallitas bebé frescas & perfumadas Deliplus,3 paquetes x 80 ud.,3.0,,https://prod-mercadona.imgix.net/images/196ddfde5df1bf2a1be89aa827b96067.jpg?fit=crop&h=300&w=300,
2390,Toallitas y pañales,Toallitas bebé frescas & perfumadas Deliplus,Paquete 80 ud.,1.05,,https://prod-mercadona.imgix.net/images/1c9c7196bee06cad0b16f1db764526f4.jpg?fit=crop&h=300&w=300,
2391,Toallitas y pañales,Toallitas bebé frescas & perfumadas Deliplus,Paquete 24 ud.,0.75,,https://prod-mercadona.imgix.net/images/9166489977350fa348c500259a885606.jpg?fit=crop&h=300&w=300,
2392,Toallitas y pañales,Toallitas infantiles cara y manos Deliplus,Paquete 20 ud.,0.75,,https://prod-mercadona.imgix.net/images/9de2336dc11894fcc203758a8086e653.jpg?fit=crop&h=300&w=300,
2393,Toallitas y pañales,Toallitas bebé pieles con tendencia atópica Deliplus,Paquete 60 ud.,1.7,,https://prod-mercadona.imgix.net/images/071d1ab6e1365ea833fb2b85057a0395.jpg?fit=crop&h=300&w=300,
2394,Toallitas y pañales,Toallitas bebé Aqua Deliplus,Paquete 60 ud.,1.7,,https://prod-mercadona.imgix.net/images/d25fb681357f0515bf9258c89616fe3c.jpg?fit=crop&h=300&w=300,
2395,Toallitas y pañales,Pañales bebé talla 1 de 2-4 kg Deliplus,Paquete 30 ud.,6.6,,https://prod-mercadona.imgix.net/images/ed715296196e53d2538c6b99f286dc14.jpg?fit=crop&h=300&w=300,
2396,Toallitas y pañales,Pañales bebé talla 1 de 2-5 kg Dodot,Paquete 58 ud.,18.95,"18,95 €",https://prod-mercadona.imgix.net/images/e8c38a1509c7245cbcb93b179451742e.jpg?fit=crop&h=300&w=300,
2397,Toallitas y pañales,Pañales bebé talla 2 de 3-6 kg Deliplus,Paquete 42 ud.,7.15,,https://prod-mercadona.imgix.net/images/3f55336e4a348c0da16cfadee0c4d2c8.jpg?fit=crop&h=300&w=300,
2398,Toallitas y pañales,Pañales bebé talla 2 de 4-8 kg Dodot,Paquete 58 ud.,18.95,"18,95 €",https://prod-mercadona.imgix.net/images/a79c645fe2467b7b1ec3e1a8f7fc24ff.jpg?fit=crop&h=300&w=300,
2399,Toallitas y pañales,Pañales bebé talla 3 de 6-10 kg Dodot,Paquete 56 ud.,18.95,"18,95 €",https://prod-mercadona.imgix.net/images/e5e3f13f4ef177bd21288730b9dfaf82.jpg?fit=crop&h=300&w=300,
2400,Toallitas y pañales,Pañales bebé talla 3 de 4-10 kg Deliplus,Paquete 45 ud.,6.95,,https://prod-mercadona.imgix.net/images/00c6f1713396ab0eed4049bd4fe06521.jpg?fit=crop&h=300&w=300,
2401,Toallitas y pañales,Pañales bebé talla 4 de 9-15 kg Deliplus,3 paquetes x 34 ud.,17.25,,https://prod-mercadona.imgix.net/images/1ef8c12cafed1ddc6c4d2ff12bdf18ac.jpg?fit=crop&h=300&w=300,
2402,Toallitas y pañales,Pañales bebé talla 4 de 9-15 kg Deliplus,Paquete 34 ud.,5.85,,https://prod-mercadona.imgix.net/images/31bf623f02283a7afa9b0c1abc0b3c0d.jpg?fit=crop&h=300&w=300,
2403,Toallitas y pañales,Pañales bebé talla 4 de 9-14 kg Dodot,Paquete 58 ud.,17.95,,https://prod-mercadona.imgix.net/images/14355795e8f57abdf21fb4112093dd04.jpg?fit=crop&h=300&w=300,
2404,Toallitas y pañales,Pañales bebé talla 5 de 13-18 kg Deliplus,3 paquetes x 30 ud.,17.85,,https://prod-mercadona.imgix.net/images/00329421f8e3abb849981b97c86e1c29.jpg?fit=crop&h=300&w=300,
2405,Toallitas y pañales,Pañales bebé talla 5 de 13-18 kg Deliplus,Paquete 30 ud.,6.05,,https://prod-mercadona.imgix.net/images/0ef7fe9c37b382bc9c75b6beee11929c.jpg?fit=crop&h=300&w=300,
2406,Toallitas y pañales,Pañales bebé talla 5 de 11-16 kg Dodot,Paquete 54 ud.,17.95,,https://prod-mercadona.imgix.net/images/b73197832baed4d8a481ff00e3caac58.jpg?fit=crop&h=300&w=300,
2407,Toallitas y pañales,Pañales bebé talla 6 de 17-28 kg Deliplus,Paquete 22 ud.,6.3,,https://prod-mercadona.imgix.net/images/0bc0ebc98b80646dcebce06790c77f25.jpg?fit=crop&h=300&w=300,
2408,Toallitas y pañales,Pañales bebé talla 6 de 13-18 kg Dodot,Paquete 48 ud.,17.95,,https://prod-mercadona.imgix.net/images/3e004516ae263da18607756f5cff31b7.jpg?fit=crop&h=300&w=300,
2409,Toallitas y pañales,Cambiador multiusos desechable Deliplus,Paquete 10 ud.,4.15,,https://prod-mercadona.imgix.net/images/4e847d354aa157f815b43a04bb360d5a.jpg?fit=crop&h=300&w=300,
2410,Toallitas y pañales,Pañal bebé braguita talla L de 12-18 kg Deliplus,Paquete 24 ud.,7.4,,https://prod-mercadona.imgix.net/images/17fda1e099559881bf19e63041d10586.jpg?fit=crop&h=300&w=300,
2411,Toallitas y pañales,Pañal bebé braguita talla XL de 16-28 kg Deliplus,Paquete 22 ud.,7.4,,https://prod-mercadona.imgix.net/images/fc15c9b3e552296bd754dc4daefd7aae.jpg?fit=crop&h=300&w=300,
2412,Toallitas y pañales,Pañal junior braguita noche infantil de 17-30 kg Deliplus,Paquete 16 ud.,10.65,,https://prod-mercadona.imgix.net/images/ab5ab01394682b55648f53037b863396.jpg?fit=crop&h=300&w=300,
2413,Toallitas y pañales,Pañal junior braguita noche infantil de 27-57 kg Deliplus,Paquete 13 ud.,10.65,,https://prod-mercadona.imgix.net/images/4ea9010e5edf81ae786b02bb544f270f.jpg?fit=crop&h=300&w=300,
2414,Higiene y cuidado,Gel corporal infantil Deliplus,Bote 600 ml,2.7,,https://prod-mercadona.imgix.net/images/95be6c94fc8755704be93e2fd9c37db8.jpg?fit=crop&h=300&w=300,
2415,Higiene y cuidado,Champú infantil Deliplus,Bote 600 ml,2.95,,https://prod-mercadona.imgix.net/images/e318d5f91204abdca8b32e4d8394912a.jpg?fit=crop&h=300&w=300,
2416,Higiene y cuidado,Gel - champú bebé para pieles atópicas Deliplus,Bote 600 ml,3.7,,https://prod-mercadona.imgix.net/images/21cf2e881ea7e25ea6721910ab5875cb.jpg?fit=crop&h=300&w=300,
2417,Higiene y cuidado,Pomada del pañal sin perfume Deliplus,Tubo 100 ml,2.75,,https://prod-mercadona.imgix.net/images/7ab942bb99afc2f8d69ffe1aff623b10.jpg?fit=crop&h=300&w=300,
2418,Higiene y cuidado,Loción corporal infantil hidratante Deliplus,Bote 600 ml,3.95,,https://prod-mercadona.imgix.net/images/722052b699f30fc261b7a06b339ad2cf.jpg?fit=crop&h=300&w=300,
2419,Higiene y cuidado,Bálsamo facial corporal infantil pieles atópicas Deliplus,Bote 200 ml,4.4,,https://prod-mercadona.imgix.net/images/4273eb8b305a6d0d851c5111c3cebd8d.jpg?fit=crop&h=300&w=300,
2420,Higiene y cuidado,Agua de colonia bebé Nenuco,Botella 500 ml,2.85,,https://prod-mercadona.imgix.net/images/5ff603934a45cb735217009e38ba9f20.jpg?fit=crop&h=300&w=300,
2421,Higiene y cuidado,Agua de colonia fresca infantil Deliplus con notas cítricas,Bote 600 ml,1.9,,https://prod-mercadona.imgix.net/images/13f6228d59a8851dadd8d1bd236d6b9f.jpg?fit=crop&h=300&w=300,
2422,Higiene y cuidado,Agua perfumada bebé con notas florales Deliplus,Bote 100 ml,3.2,,https://prod-mercadona.imgix.net/images/08e4dcfa4e5e2419bcb0b0fc24502d94.jpg?fit=crop&h=300&w=300,
2423,Higiene y cuidado,"Solución fisiológica salina 0,9 % Deliplus",Caja 30 ud.,3.23,,https://prod-mercadona.imgix.net/images/e9131cfd624d67a0a93009cfbfe78cc5.jpg?fit=crop&h=300&w=300,
2424,Higiene y cuidado,Gasas para bebé no tejidas Deliplus,Paquete 100 ud.,1.97,,https://prod-mercadona.imgix.net/images/de6a3878e3ddc47a3d196f29f851b4da.jpg?fit=crop&h=300&w=300,
2425,Higiene y cuidado,Esponja anatómica para bebés Deliplus,Paquete 1 ud.,0.9,,https://prod-mercadona.imgix.net/images/2ef8352238b00862cbc7d0dead32d39f.jpg?fit=crop&h=300&w=300,
2426,Higiene y cuidado,Polvos de talco Deliplus,Bote 200 g,1.7,,https://prod-mercadona.imgix.net/images/95faefd03c5e337ec06d5f989535423a.jpg?fit=crop&h=300&w=300,
2427,Higiene y cuidado,Bastoncillos algodón para bebés Deliplus,Caja 60 ud.,1.05,,https://prod-mercadona.imgix.net/images/14c6f53b241eabd431dffae364f87e51.jpg?fit=crop&h=300&w=300,
2428,Biberón y chupete,Biberón 150 ml tetina silicona flujo lento Deliplus +0 meses,1 ud.,3.3,,https://prod-mercadona.imgix.net/images/c0efe2f357bd88b60884787a35e09efe.jpg?fit=crop&h=300&w=300,
2429,Biberón y chupete,Biberón 360 ml tetina silicona tres posiciones Deliplus +1 mes,1 ud.,3.8,,https://prod-mercadona.imgix.net/images/3c5963b175ab2441b5bc8bfa8390a9b6.jpg?fit=crop&h=300&w=300,
2430,Biberón y chupete,Tetina silicona tres posiciones Deliplus +1 mes,Paquete 2 ud.,2.5,,https://prod-mercadona.imgix.net/images/b1a3b46e627f97c3e46a466c9b59b46b.jpg?fit=crop&h=300&w=300,
2431,Biberón y chupete,Tetina silicona papillas espesas Deliplus +4 meses,Paquete 2 ud.,2.5,,https://prod-mercadona.imgix.net/images/82253253b6bc1d9ef4d521d8d1dce7eb.jpg?fit=crop&h=300&w=300,
2432,Biberón y chupete,Cepillo limpiabiberón y tetina Deliplus,Paquete 1 ud.,2.5,,https://prod-mercadona.imgix.net/images/3dffd4d87016da8765ed88be14bd3d9e.jpg?fit=crop&h=300&w=300,
2433,Biberón y chupete,Limpiador bebé para biberones y tetinas Deliplus,Bote 500 ml,2.9,,https://prod-mercadona.imgix.net/images/2cb0eb4b8fb1ef3b778920eccd31ba6b.jpg?fit=crop&h=300&w=300,
2434,Biberón y chupete,Chupete silicona reversible Deliplus +0 a 6 meses,Paquete 1 ud.,2.5,,https://prod-mercadona.imgix.net/images/84b05d45b07439b152692417c150cadc.jpg?fit=crop&h=300&w=300,
2435,Biberón y chupete,Chupete silicona reversible Deliplus +6 a 18 meses luminiscente,Paquete 1 ud.,2.5,,https://prod-mercadona.imgix.net/images/0ea9eb3e3aceae8e0b9b3fae630290a3.jpg?fit=crop&h=300&w=300,
2436,Biberón y chupete,Chupete silicona reversible Deliplus +18 meses,Paquete 1 ud.,2.5,,https://prod-mercadona.imgix.net/images/14a14b5c9b1bdf315bfc7363cfa5a439.jpg?fit=crop&h=300&w=300,
2437,Perro,Paté perro junior Delikuit con ternera y cordero,Paquete 4 ud. (400 g),2.25,,https://prod-mercadona.imgix.net/images/1c5d86e676019e5393757b1baac0a212.jpg?fit=crop&h=300&w=300,
2438,Perro,"Paté perro adulto Delikuit con ternera, hígado y verduras",Tarrina 300 g,0.95,,https://prod-mercadona.imgix.net/images/690db847b6d6f89d19538948eed8957e.jpg?fit=crop&h=300&w=300,
2439,Perro,Salchicha perro adulto Delikuit con pollo y arroz,1 kg,1.9,,https://prod-mercadona.imgix.net/images/c140c290c05a01ec329e846fdaf87369.jpg?fit=crop&h=300&w=300,
2440,Perro,Paté perro adulto Delikuit con ternera y cordero,Paquete 4 ud. (400 g),2.25,,https://prod-mercadona.imgix.net/images/a870d76611647a899c75d174f00a329c.jpg?fit=crop&h=300&w=300,
2441,Perro,"Trozos en salsa perro adulto Delikuit con ternera, pavo y verduras",Tarrina 300 g,0.95,,https://prod-mercadona.imgix.net/images/35e88198ada755d311dbc44a1106b2f4.jpg?fit=crop&h=300&w=300,
2442,Perro,Paté perro adulto Delikuit con salmón y verduras,Tarrina 300 g,0.95,,https://prod-mercadona.imgix.net/images/307605111fd904c84b4ae5b405da79e5.jpg?fit=crop&h=300&w=300,
2443,Perro,Trozos en salsa perro adulto Delikuit con salmón y verduras,Tarrina 300 g,0.95,,https://prod-mercadona.imgix.net/images/327619998acebafc86875f36c7c289e3.jpg?fit=crop&h=300&w=300,
2444,Perro,Trozos en salsa para perros adultos Quartett con pollo y verduras,Paquete 4 ud. (400 g),2.25,,https://prod-mercadona.imgix.net/images/1f830a7a6b4f85ab3a1ed0c7662d1d88.jpg?fit=crop&h=300&w=300,
2445,Perro,"Bocaditos en salsa perro adulto Special Dog Excellence con ternera, hígado y verduras","Bote 1,23 kg",1.5,,https://prod-mercadona.imgix.net/images/8177b80f978aa45728d829285b8067b5.jpg?fit=crop&h=300&w=300,
2446,Perro,Bocaditos en salsa perro adulto Special Dog Excellence con salmón y verduras,"Bote 1,23 kg",1.5,,https://prod-mercadona.imgix.net/images/7cf69a2dd67016694191f93777116a0d.jpg?fit=crop&h=300&w=300,
2447,Perro,"Gelatina perros adultos Quartett con buey, pollo y verduras",Paquete 4 ud. (400 g),2.25,,https://prod-mercadona.imgix.net/images/7d154c82ad2b2a4271144fbf779a33a5.jpg?fit=crop&h=300&w=300,
2448,Perro,Paté perro adulto Delikuit con pollo,Bote 800 g,1.75,,https://prod-mercadona.imgix.net/images/95aa76d8ac6f0774f5a363e95b4f07db.jpg?fit=crop&h=300&w=300,
2449,Perro,"Comida perro júnior Compy con pollo, arroz, frutas y verduras",Paquete 4 kg,6.25,,https://prod-mercadona.imgix.net/images/f247f1e0ab8e3ecd4824247a50426cda.jpg?fit=crop&h=300&w=300,
2450,Perro,"Comida perro adulto Compy con ternera, pollo, verduras y arroz",Saco 18 kg,16.95,,https://prod-mercadona.imgix.net/images/f36babf90fe277ac5498ce6446ef5fa7.jpg?fit=crop&h=300&w=300,
2451,Perro,"Comida perro adulto Compy con pollo, ternera, frutas y verduras",Saco 18 kg,18.75,,https://prod-mercadona.imgix.net/images/7812e8d82c9c9a3d5cd7edb64d5a10bf.jpg?fit=crop&h=300&w=300,
2452,Perro,"Comida perro adulto Compy con pollo, ternera, frutas y verduras",Paquete 4 kg,5.85,,https://prod-mercadona.imgix.net/images/defe8b67e17e1de95ce5891f7f956ad8.jpg?fit=crop&h=300&w=300,
2453,Perro,"Comida perro adulto Compy con pollo, ternera, frutas y verduras",Paquete 3 kg,5.0,,https://prod-mercadona.imgix.net/images/0e4776f54c046ca9fc5d93d609179726.jpg?fit=crop&h=300&w=300,
2454,Perro,Aritos perro adulto y sénior Compy,Saco 4 kg,8.3,,https://prod-mercadona.imgix.net/images/446ef36b9a5b3d45d85bb72aa4a2088b.jpg?fit=crop&h=300&w=300,
2455,Perro,Mini aritos perro adulto y sénior Compy,"Paquete 1,5 kg",4.15,,https://prod-mercadona.imgix.net/images/97045254cf9d4a494a417a69bd73b783.jpg?fit=crop&h=300&w=300,
2456,Perro,Comida perro adulto Compy original,Saco 18 kg,13.1,,https://prod-mercadona.imgix.net/images/9d65f8669d70fe74f8441cc076458318.jpg?fit=crop&h=300&w=300,
2457,Perro,"Comida perro sénior y adultos esterilizados Supreme Compy con pollo, frutas y verduras",Paquete 4 kg,6.25,,https://prod-mercadona.imgix.net/images/06a0ec1cf331c2bd8a5c3418351fd026.jpg?fit=crop&h=300&w=300,
2458,Perro,"Comida perro adulto Compy con salmón, atún, frutas y verduras",Paquete 4 kg,6.25,,https://prod-mercadona.imgix.net/images/4a8aa5e8f145237bfe57d5b5d41235b7.jpg?fit=crop&h=300&w=300,
2459,Perro,Comida perro júnior Supreme Compy pollo fresco con frutas y verduras,Paquete 3 kg,9.5,,https://prod-mercadona.imgix.net/images/b97e7c6f73977b2b58ede835cc0d5481.jpg?fit=crop&h=300&w=300,
2460,Perro,"Comida perro júnior Supreme Compy con pollo fresco, frutas y verduras","Paquete 1,5 kg",5.25,,https://prod-mercadona.imgix.net/images/0acfc3a5b9f725d4a2b5bb9f7eb94669.jpg?fit=crop&h=300&w=300,
2461,Perro,"Comida perro sénior y adultos esterilizados Supreme Compy con pollo, frutas y verduras",Paquete 3 kg,9.5,,https://prod-mercadona.imgix.net/images/df2f57ffbae2ae84c4e15ec0d9354891.jpg?fit=crop&h=300&w=300,
2462,Perro,Comida perro sénior esterilizados Supreme Compy pollo fresco con frutas y verduras,"Paquete 1,5 kg",5.25,,https://prod-mercadona.imgix.net/images/13fce346978da5bba7251fc4d7dd61ab.jpg?fit=crop&h=300&w=300,
2463,Perro,Comida perro adulto Supreme Compy salmón fresco con frutas y verduras,Saco 10 kg,24.5,,https://prod-mercadona.imgix.net/images/06855deba17638e02f3d89bbb8d01897.jpg?fit=crop&h=300&w=300,
2464,Perro,Comida perro adulto Supreme Compy salmón fresco con frutas y verduras,Paquete 3 kg,9.5,,https://prod-mercadona.imgix.net/images/429f7abe723f184825bd581d2e4cdcd6.jpg?fit=crop&h=300&w=300,
2465,Perro,Comida perro adulto Supreme Compy salmón fresco con frutas y verduras,"Paquete 1,5 kg",5.25,,https://prod-mercadona.imgix.net/images/1b14358f5b1ee191fe7720a2e2db971e.jpg?fit=crop&h=300&w=300,
2466,Perro,Comida perro adulto Supreme Compy pollo fresco con frutas y verduras,Saco 10 kg,24.5,,https://prod-mercadona.imgix.net/images/b83cc921c9e362d97363b1f7c8162485.jpg?fit=crop&h=300&w=300,
2467,Perro,Comida perro adulto Supreme Compy pollo fresco con frutas y verduras,Paquete 3 kg,9.5,,https://prod-mercadona.imgix.net/images/bde2b24e27567b9eb706c59c34ea3e75.jpg?fit=crop&h=300&w=300,
2468,Perro,Comida perro adulto Supreme Compy pollo fresco con frutas y verduras,"Paquete 1,5 kg",5.25,,https://prod-mercadona.imgix.net/images/8e95110dc5b64b20479426779400374f.jpg?fit=crop&h=300&w=300,
2469,Perro,Ministick dental perro adulto Compy,Paquete 250 g,2.2,,https://prod-mercadona.imgix.net/images/da3f038cad0acfdea0c4acb24bc5fcb1.jpg?fit=crop&h=300&w=300,
2470,Perro,Stick dental perro adulto con menta Compy,Paquete 208 g,1.75,,https://prod-mercadona.imgix.net/images/e1709e81afca84d53b8c28cfc81f6e0d.jpg?fit=crop&h=300&w=300,
2471,Perro,Huesos de cuero con pollo y zanahoria Compy perro adulto,Paquete 2 ud. (120 g),1.75,,https://prod-mercadona.imgix.net/images/f29862bc2c2f87459f3d760d0abfa29c.jpg?fit=crop&h=300&w=300,
2472,Perro,Hueso dental perro adulto sabor menta y perejil Compy,Paquete 3 ud. (192 g),1.75,,https://prod-mercadona.imgix.net/images/793831d6e778e16446535abe44706c55.jpg?fit=crop&h=300&w=300,
2473,Perro,Bolsas para residuos caninos Nuske Doggy bags,Paquete 45 ud.,1.3,,https://prod-mercadona.imgix.net/images/8ef33001c04f5a1e3247cf5d3381b7b4.jpg?fit=crop&h=300&w=300,
2474,Perro,Champú perros y gatos con aloe vera Nuske efecto repelente,Botella 310 ml,3.5,,https://prod-mercadona.imgix.net/images/63287eedb880186ac90e2198a398d79d.jpg?fit=crop&h=300&w=300,
2475,Perro,Agua de colonia para perros y gatos Krislin,Spray 250 ml,4.0,,https://prod-mercadona.imgix.net/images/0e60032d54ab1bb66faf325269acc938.jpg?fit=crop&h=300&w=300,
2476,Perro,Snack palitos perro adulto con pollo y ternera Compy,Paquete 200 g,1.1,,https://prod-mercadona.imgix.net/images/fc37029b6ca40eb9441a6cde919af817.jpg?fit=crop&h=300&w=300,
2477,Perro,Snack corazones perro adulto Compy,Paquete 350 g,1.65,,https://prod-mercadona.imgix.net/images/6c6714750f676bdad042768d04955b07.jpg?fit=crop&h=300&w=300,
2478,Perro,Snack tiras perro adulto Compy para todas las razas,Paquete 200 g,1.1,,https://prod-mercadona.imgix.net/images/e28cb79f432a725d3049cc21c3ba87a0.jpg?fit=crop&h=300&w=300,
2479,Perro,Snack barritas perro adulto de ternera y cordero Compy,8 ud. x 11 g,1.05,,https://prod-mercadona.imgix.net/images/b91f4f4ceb4d8c3745b893750a572951.jpg?fit=crop&h=300&w=300,
2480,Perro,Snack barritas perro adulto de pollo e hígado Compy,8 ud. x 11 g,1.05,,https://prod-mercadona.imgix.net/images/17de9c32ee10ae75f0251d075d4993da.jpg?fit=crop&h=300&w=300,
2481,Perro,Snack galletas perro adulto con pollo y ternera Compy razas pequeñas y medianas,Paquete 350 g,1.5,,https://prod-mercadona.imgix.net/images/5429638ea2aaebd6584e005a1161b93c.jpg?fit=crop&h=300&w=300,
2482,Perro,Snack galletas perro adulto con pollo y ternera Compy razas medianas y grandes,Paquete 700 g,1.95,,https://prod-mercadona.imgix.net/images/54988ca540b37197c2bee8b9d850c99e.jpg?fit=crop&h=300&w=300,
2483,Gato,"Bocaditos en salsa gato adulto Lechat Excellence con pollo, pavo y verduras",Bote 400 g,0.7,,https://prod-mercadona.imgix.net/images/f7b369e5941cec101f1710769c47ca53.jpg?fit=crop&h=300&w=300,
2484,Gato,"Bocaditos en salsa gato adulto Lechat Excellence con salmón, trucha y verduras",Bote 400 g,0.7,,https://prod-mercadona.imgix.net/images/7b3ad728d68666008f7f4b4ecda401ce.jpg?fit=crop&h=300&w=300,
2485,Gato,Mousse con lenguado y salmón gato adulto Delikuit,4 tarrinas x 85 g,2.0,,https://prod-mercadona.imgix.net/images/a8a3813be7fed348c745fbbb4c510d43.jpg?fit=crop&h=300&w=300,
2486,Gato,Mousse con ternera y pollo gato adulto Delikuit,4 tarrinas x 85 g,2.0,,https://prod-mercadona.imgix.net/images/f45fc61a285dc30ae5c6b7c7319cccd6.jpg?fit=crop&h=300&w=300,
2487,Gato,Bocaditos en gelatina gato júnior Delikuit con pollo y pavo,Paquete 8 ud. (800 g),2.5,,https://prod-mercadona.imgix.net/images/cff6be7f5e3bb601884d53db9e25f823.jpg?fit=crop&h=300&w=300,
2488,Gato,Bocaditos en gelatina gato adulto Delikuit,8 ud. x 100 g,2.3,,https://prod-mercadona.imgix.net/images/ca6cab2d8dd92957fc8395bc0c8ed08d.jpg?fit=crop&h=300&w=300,
2489,Gato,Bocaditos en gelatina gato adulto Delikuit,8 ud. x 100 g,2.3,,https://prod-mercadona.imgix.net/images/5182eda869d4213d3b345404391fed09.jpg?fit=crop&h=300&w=300,
2490,Gato,Gelatina gato adulto selección de aves Quartett,Paquete 4 ud. (340 g),1.8,,https://prod-mercadona.imgix.net/images/af2bb28e3b69ec2ebcd7a48fe217c749.jpg?fit=crop&h=300&w=300,
2491,Gato,Gelatina gato adulto selección de pescado Quartett,Paquete 4 ud. (340 g),1.8,,https://prod-mercadona.imgix.net/images/786e674060bdb8273f461d172e20f582.jpg?fit=crop&h=300&w=300,
2492,Gato,Bocaditos en salsa gato adulto Delikuit esterilizado,8 ud. x 100 g,2.75,,https://prod-mercadona.imgix.net/images/e8e94b903d1f176a6d49af25955837ec.jpg?fit=crop&h=300&w=300,
2493,Gato,Paté gato júnior Delikuit con pollo y ternera,Paquete 4 ud. (400 g),2.0,,https://prod-mercadona.imgix.net/images/be41e529323283dcb0e5022434446c50.jpg?fit=crop&h=300&w=300,
2494,Gato,Paté gato adulto Delikuit con pollo y ternera,Paquete 4 ud. (400 g),2.0,,https://prod-mercadona.imgix.net/images/fce4116cb323e1de1662f84bd0c4fe10.jpg?fit=crop&h=300&w=300,
2495,Gato,Paté gato adulto Delikuit con salmón y atún,Paquete 4 ud. (400 g),2.0,,https://prod-mercadona.imgix.net/images/16ead34bec730edce05f2bd9280dc0b3.jpg?fit=crop&h=300&w=300,
2496,Gato,Paté gato adulto Delikuit con ternera,Bote 395 g,1.2,,https://prod-mercadona.imgix.net/images/a065d8f41db25ffbcf585540811e1a26.jpg?fit=crop&h=300&w=300,
2497,Gato,"Comida gato júnior Compy con pollo, frutas y verduras","Paquete 1,5 kg",3.3,,https://prod-mercadona.imgix.net/images/a666833230deb0c5f81e86816b0e0614.jpg?fit=crop&h=300&w=300,
2498,Gato,"Comida gato adulto Compy con pollo, ternera, frutas y verduras",Paquete 10 kg,12.5,,https://prod-mercadona.imgix.net/images/ecea85917759d0e1add983c35b496f60.jpg?fit=crop&h=300&w=300,
2499,Gato,"Comida gato adulto Compy con pollo, ternera, frutas y verduras",Paquete 2 kg,2.95,,https://prod-mercadona.imgix.net/images/8800b5aabe3f0d84ad498be931759dd3.jpg?fit=crop&h=300&w=300,
2500,Gato,"Comida gato adulto Compy con salmón, atún, frutas y verduras",Paquete 10 kg,13.5,,https://prod-mercadona.imgix.net/images/6f1887f41173ce0384b03771a1ba57b0.jpg?fit=crop&h=300&w=300,
2501,Gato,"Comida gato adulto Compy con salmón, atún, frutas y verduras",Paquete 2 kg,3.1,,https://prod-mercadona.imgix.net/images/764a33a1b6853219cb817ad773e5c3b0.jpg?fit=crop&h=300&w=300,
2502,Gato,"Comida gato esterilizado light Compy con pollo, frutas y verduras","Paquete 1,5 kg",3.4,,https://prod-mercadona.imgix.net/images/cea8b1100d8add9bd7c7ef17589a7c33.jpg?fit=crop&h=300&w=300,
2503,Gato,"Comida gato júnior Supreme Compy con pollo, frutas y verduras",Paquete 800 g,3.3,,https://prod-mercadona.imgix.net/images/252c88801129db5d759304350143d6fc.jpg?fit=crop&h=300&w=300,
2504,Gato,"Comida gato adulto Supreme Compy con pollo, frutas y verduras","Paquete 1,5 kg",5.3,,https://prod-mercadona.imgix.net/images/de12125a02b803330f90e208d79fa3ed.jpg?fit=crop&h=300&w=300,
2505,Gato,"Comida gato esterilizado light Supreme Compy con pollo fresco, frutas y verduras","Paquete 1,5 kg",5.3,,https://prod-mercadona.imgix.net/images/296a54eb252f2552345e581cf83f8b92.jpg?fit=crop&h=300&w=300,
2506,Gato,"Comida gato adulto Supreme Compy con salmón, frutas y verduras","Paquete 1,5 kg",5.3,,https://prod-mercadona.imgix.net/images/fe66c8be1d37e1367134334646902ad7.jpg?fit=crop&h=300&w=300,
2507,Gato,"Comida gato sénior Supreme Compy con pollo fresco, frutas y verduras","Paquete 1,5 kg",5.3,,https://prod-mercadona.imgix.net/images/fda64270ee8fb909c39674984721a5ad.jpg?fit=crop&h=300&w=300,
2508,Gato,Arena para gato antibacterias Nuske,Paquete 5 kg,1.4,,https://prod-mercadona.imgix.net/images/2391d7974190920d576ab7490642803e.jpg?fit=crop&h=300&w=300,
2509,Gato,Arena para gato aglomerante Nuske perfumada,Caja 5 kg,3.75,,https://prod-mercadona.imgix.net/images/f21119185ae69c41e0705585fa3b2b3a.jpg?fit=crop&h=300&w=300,
2510,Gato,Arena para gato de perlas sílice Single,Paquete 4 L,3.55,,https://prod-mercadona.imgix.net/images/efb831d9ac01c05f433b803d426905a5.jpg?fit=crop&h=300&w=300,
2511,Gato,Malta para gato Natura con queso,Tubo 100 g,4.0,,https://prod-mercadona.imgix.net/images/2baa4a05a71339b0772b83fd3ed330bb.jpg?fit=crop&h=300&w=300,
